{
  "$schema": "../schemas/conformance-kit.schema.json",
  "schemaVersion": 1,
  "standardId": "edge-canon.next",
  "status": "draft",
  "requirementsRegistry": "standard/requirements.json",
  "suites": [
    {"id": "EC-WEB", "familyId": "web-fetch-events", "fixtureStatus": "draft", "oracleStatus": "draft", "harnessStatus": "draft", "casesPath": "conformance/cases/web-fetch-events.json", "harnessPath": "conformance/harness/web-fetch-events/harness.json"},
    {"id": "EC-ROUTING", "familyId": "routing-static-assets", "fixtureStatus": "draft", "oracleStatus": "draft", "harnessStatus": "draft", "casesPath": "conformance/cases/routing-static-assets.json", "harnessPath": "conformance/harness/routing-static-assets/harness.json"},
    {"id": "EC-STREAM", "familyId": "streams-websockets-background-work", "fixtureStatus": "planned", "oracleStatus": "planned", "harnessStatus": "planned", "casesPath": null, "harnessPath": null},
    {"id": "EC-WEBAPI", "familyId": "web-platform-apis", "fixtureStatus": "draft", "oracleStatus": "draft", "harnessStatus": "draft", "casesPath": "conformance/cases/web-platform-apis.json", "harnessPath": "conformance/harness/web-platform-apis/harness.json"},
    {"id": "EC-NODE", "familyId": "node-npm-subset", "fixtureStatus": "planned", "oracleStatus": "planned", "harnessStatus": "planned", "casesPath": null, "harnessPath": null},
    {"id": "EC-SSR", "familyId": "ssr-streaming-ssr-isr", "fixtureStatus": "planned", "oracleStatus": "planned", "harnessStatus": "planned", "casesPath": null, "harnessPath": null},
    {"id": "EC-ENV", "familyId": "environment-secrets", "fixtureStatus": "planned", "oracleStatus": "planned", "harnessStatus": "planned", "casesPath": null, "harnessPath": null},
    {"id": "EC-DATA", "familyId": "kv-cache-sql-blob", "fixtureStatus": "planned", "oracleStatus": "planned", "harnessStatus": "planned", "casesPath": null, "harnessPath": null},
    {"id": "EC-ASYNC", "familyId": "queue-schedule-service-binding", "fixtureStatus": "planned", "oracleStatus": "planned", "harnessStatus": "planned", "casesPath": null, "harnessPath": null},
    {"id": "EC-STATE", "familyId": "stateful-objects", "fixtureStatus": "planned", "oracleStatus": "planned", "harnessStatus": "planned", "casesPath": null, "harnessPath": null},
    {"id": "EC-BIND", "familyId": "logical-resource-bindings", "fixtureStatus": "planned", "oracleStatus": "planned", "harnessStatus": "planned", "casesPath": null, "harnessPath": null},
    {"id": "EC-ARTIFACT", "familyId": "canonical-build-artifact", "fixtureStatus": "draft", "oracleStatus": "draft", "harnessStatus": "draft", "casesPath": "conformance/cases/canonical-build-artifact.json", "harnessPath": "conformance/harness/canonical-build-artifact/harness.json"},
    {"id": "EC-DEPLOY", "familyId": "deployment-preview-rollback", "fixtureStatus": "planned", "oracleStatus": "planned", "harnessStatus": "planned", "casesPath": null, "harnessPath": null},
    {"id": "EC-OBS", "familyId": "observability", "fixtureStatus": "planned", "oracleStatus": "planned", "harnessStatus": "planned", "casesPath": null, "harnessPath": null},
    {"id": "EC-LIFECYCLE", "familyId": "data-export-deletion", "fixtureStatus": "planned", "oracleStatus": "planned", "harnessStatus": "planned", "casesPath": null, "harnessPath": null}
  ]
}
